"A0082","abstract class"
"A0008","method loop while for string number button"
"B0026","class method java array string"
"B0018","method for class java string decimal text"
"A0065","array"
"A0043","array number sort"
"A0020","decimal java array for class sort string text count method number"
"A0019","inherit abstract class string java panel vector button text method array merge"
"A0080","method function java string java merge sort array number"
"A0041","function java method constructor string for data button array sort merge number"
"A0018","merge sort partition"
"A0067","for loop array java button partition merge number sort"
"A0064","array java string merge sort"
"A0052","class java partition merge sort array"
"A0074","for loop java array inherit class constructor input abstract morphism button vector merge sort"
"A0001","class cast java button"
"A0057","partition merge sort array input"
"A0073","for java loop abstract class number merge partition sort array"
"A0040","class java sort algorithms"
"A0037","string"
"A0034","array"
"A0061","class array data java merge sort"
"A0024","merge sort partition java array method constructor"
"A0044","string array merge sort"
"A0042","partition merge sort array"
"B0025","while java encapsulation class"
"A0081","merge sort array"
"A0009","string partition merge sort java array number count method"
"A0047","java string class vector panel"
"A0011","method string class abstract inherit constructor java for number decimal iterate vector array button sort",
"A0054","for"
"A0077","partition merge sort"
"A0075","partition merge sort array"
"A0048","loop while array input java merge sort partition"
"A0030","action class"
"A0046","panel java vector text method string abstract class partition merge sort data"
"A0071","inherit array merge sort"
"A0049","string java array class"
"A0029","java string cast abstract class decimal for partition merge sort array"
"B0020","class method string array partition merge sort"
"B0009","loop"
"A0005","array java constructor abstract class extends method cast string for button merge sort panel"
"B0005","vector java"
"A0084","class inherit java string number for"
"B0027","for loop accessor method string java"
"B0007","input number java while loop string class for text panel vector merge sort"
"B0012","for java loop"
"A0088","java array"
"A0069","merge sort partition array"
"A0066","text java sort"
"A0010","java method class abstract"
"A0056","for java loop vector array constructor class merge sort"
"A0059","merge sort"
"A0021","method class string for number java cast text input button action actionlistener"
"A0033","abstract class java merge sort button"
"A0026","merge sort method input"
"A0022","array java method string merge sort"
"B0013","java"
"A0087","merge sort"
"A0025","array class method constructor java button panel decimal for"
"A0039","java loop while array input class method panel text button string"
"A0015",""
"A0050","java input array function loop while"
